{
  "$schema": "./repository-architecture.schema.json",
  "schemaVersion": 1,
  "vocabulary": {
    "Module": "A cohesive capability with one stable purpose and an explicit boundary.",
    "Interface": "The smallest public contract a consumer needs in order to use a Module.",
    "Implementation": "The replaceable files and logic hidden behind a Module Interface.",
    "Depth": "How much useful complexity a Module hides behind its simpler Interface.",
    "Seam": "A named boundary where two Modules exchange data, files, or control.",
    "Adapter": "A boundary-specific translation that connects a Module to an external harness.",
    "Leverage": "The number and importance of consumers improved by one boundary change.",
    "Locality": "The degree to which one concept and its change evidence stay together."
  },
  "modules": [
    {
      "id": "skill-library",
      "title": "Canonical skill library",
      "interface": "A tracked physical skills/<id>/SKILL.md entrypoint.",
      "implementations": ["skills"],
      "ownershipPrefixes": ["skills"],
      "depth": "foundational",
      "seams": ["catalog-discovery", "team-composition", "distribution-adapters"],
      "leverage": "The catalog, generic Agent packs, installer, and full-library manifests consume this inventory.",
      "locality": "Instructions, optional scripts, references, and assets stay under one skill directory."
    },
    {
      "id": "team-composition",
      "title": "Team and starter-kit composition",
      "interface": "config/team-manifest.json defines the top-level roster and Kits; config/agent-hierarchy.json plus per-manager routing and source locks define optional executive child pyramids.",
      "implementations": ["agents", "starter-kits", "config/team-manifest.json", "config/agent-hierarchy.json", "config/cto-specialists.json", "config/cpo-specialists.json", "config/cco-specialists.json", "config/cfo-specialists.json", "config/cdo-specialists.json", "config/cqo-specialists.json", "config/cmo-specialists.json", "config/cro-specialists.json", "config/cso-specialists.json", "config/coo-specialists.json", "config/clo-specialists.json", "config/agent-sources.lock.json", "scripts/build_agent_skill_indexes.py", "scripts/build_executive_subagent_sources.py"],
      "ownershipPrefixes": ["agents", "starter-kits", "config/team-manifest.json", "config/agent-hierarchy.json", "config/agent-hierarchy.schema.json", "config/specialist-routing.schema.json", "config/cto-specialists.json", "config/cpo-specialists.json", "config/cco-specialists.json", "config/cfo-specialists.json", "config/cdo-specialists.json", "config/cqo-specialists.json", "config/cmo-specialists.json", "config/cro-specialists.json", "config/cso-specialists.json", "config/coo-specialists.json", "config/clo-specialists.json", "config/agent-sources.lock.json", "scripts/build_agent_skill_indexes.py", "scripts/build_executive_subagent_sources.py"],
      "depth": "composed",
      "seams": ["skill-library", "safe-installation", "distribution-adapters"],
      "leverage": "One manifest contract updates roster validation, outcome-kit routing, installation, and generated discovery.",
      "locality": "Structural orchestration stays in the manifest while role behavior and Kit wave semantics stay in their Agent and runbook directories."
    },
    {
      "id": "safe-installation",
      "title": "Preview-first workspace installation",
      "interface": "./install.sh [--apply] [--source PATH] [--destination PATH] [--layout isolated|coordinated] [--skill-tier role-only|core|standard] [--team-tier core|full] (--kit ID|--agent ID).",
      "implementations": ["install.sh", "bin/agi-super-team.mjs", "bin/installer"],
      "ownershipPrefixes": ["install.sh", "bin", "bin/agi-super-team.mjs", "bin/installer", ".npmignore", "CHARTER.md", "COLLABORATION.md", "setup.md"],
      "depth": "composed",
      "seams": ["team-composition", "skill-library", "verification-evidence"],
      "leverage": "One safety boundary protects every generic workspace installation.",
      "locality": "Installer behavior and its integration fixtures change together."
    },
    {
      "id": "catalog-discovery",
      "title": "Skill taxonomy and discovery catalog",
      "interface": "Taxonomy, reviewed Gold labels, Skill provenance, and digest-matched curation evidence in; catalog and Agent discovery indexes out.",
      "implementations": ["scripts/build_skill_catalog.py", "scripts/skill_evidence.py", "scripts/build_skill_taxonomy_evaluation.py", "config/skill-provenance.json", "config/skill-curation.json", "config/skill-taxonomy.json", "config/skill-taxonomy-gold.json", "catalog"],
      "ownershipPrefixes": ["catalog", "config/skill-taxonomy.json", "config/skill-taxonomy-gold.json", "config/skill-taxonomy-gold.schema.json", "config/skill-taxonomy-evaluation.schema.json", "config/skill-index.schema.json", "config/skill-provenance.json", "config/skill-provenance.schema.json", "config/skill-curation.json", "config/skill-curation.schema.json", "docs/skill-provenance-and-scoring.md", "docs/skill-taxonomy-gold-set.md", "scripts/build_skill_catalog.py", "scripts/skill_evidence.py", "scripts/build_skill_taxonomy_evaluation.py"],
      "depth": "composed",
      "seams": ["skill-library", "public-navigation", "verification-evidence"],
      "leverage": "A single classification rule improves human browsing and machine discovery.",
      "locality": "Taxonomy rules, generator, generated outputs, and drift tests have explicit paths."
    },
    {
      "id": "distribution-adapters",
      "title": "Harness distribution adapters",
      "interface": "renderAdapterArtifacts + buildConnectionSpec, harness manifests, and curated packages with explicit evidence status.",
      "implementations": ["bin/adapters", ".agents", ".codex", ".codex-plugin", "config/harness-adapters", "plugins", "scripts/build_codex_csuite_adapter.py", ".claude-plugin", ".cursor-plugin", ".kimi-plugin", "gemini-extension.json"],
      "ownershipPrefixes": ["bin/adapters", ".agents", ".codex", ".codex-plugin", "config/harness-adapters", "plugins", "scripts/build_codex_csuite_adapter.py", ".claude-plugin", ".cursor-plugin", ".kimi-plugin", "gemini-extension.json"],
      "depth": "boundary",
      "seams": ["team-composition", "skill-library", "verification-evidence"],
      "leverage": "Adapters isolate harness conventions from canonical repository content.",
      "locality": "Each distribution keeps its manifests, curated content, and support statement together."
    },
    {
      "id": "verification-evidence",
      "title": "Repository contracts and evidence",
      "interface": "npm test and npm run validate:strict produce deterministic pass/fail evidence.",
      "implementations": ["scripts", "tests", ".github/workflows"],
      "ownershipPrefixes": ["scripts", "tests", ".github", ".githooks", "requirements-dev.txt", "package.json", "design-qa.md", "config/skill-quality-baseline.json", "catalog/skill-quality.json", "docs/data/verification-receipt.json", "docs/data/verification-receipt.schema.json"],
      "depth": "foundational",
      "seams": ["skill-library", "team-composition", "safe-installation", "catalog-discovery", "distribution-adapters"],
      "leverage": "One contract gate prevents drift across every public surface.",
      "locality": "Checks live beside repository scripts while behavior fixtures remain under tests."
    },
    {
      "id": "public-navigation",
      "title": "Public documentation and site",
      "interface": "README routes users to installation, outcomes, skills, Agents, evidence, and contribution.",
      "implementations": ["README.md", "README_CN.md", "README.es-ES.md", "docs", "cookbook", "assets"],
      "ownershipPrefixes": ["README.md", "README_CN.md", "README.es-ES.md", "docs", "cookbook", "assets", "SKILL-AGENT-MATRIX.md", "STARTUP.md"],
      "depth": "boundary",
      "seams": ["catalog-discovery", "verification-evidence", "governance-memory"],
      "leverage": "A small set of maintained entrypoints serves GitHub visitors, search, and coding agents.",
      "locality": "Editorial pages link to authorities instead of copying inventory or compatibility claims."
    },
    {
      "id": "governance-memory",
      "title": "Governance and decision memory",
      "interface": "CONTEXT.md, ARCHITECTURE.md, ADRs, contribution, security, and governance records.",
      "implementations": ["CONTEXT.md", "ARCHITECTURE.md", "docs/adr"],
      "ownershipPrefixes": ["AGENTS.md", "ARCHITECTURE.md", "CLAUDE.md", "CODE_OF_CONDUCT.md", "CONTEXT.md", "CONTRIBUTING.md", "LICENSE", "SECURITY.md", ".gitattributes", ".gitignore", "config", "docs/adr"],
      "depth": "foundational",
      "seams": ["public-navigation", "verification-evidence"],
      "leverage": "Recorded terminology and decisions reduce contradictory future edits.",
      "locality": "Stable terms live in CONTEXT while consequential decisions live in numbered ADRs."
    }
  ],
  "pathOwnership": [
    {"path": ".github", "role": "governance", "module": "verification-evidence", "authority": false},
    {"path": ".gitattributes", "role": "governance", "module": "governance-memory", "authority": false},
    {"path": ".githooks", "role": "evidence", "module": "verification-evidence", "authority": false},
    {"path": ".gitignore", "role": "governance", "module": "governance-memory", "authority": false},
    {"path": ".npmignore", "role": "implementation", "module": "safe-installation", "authority": false},
    {"path": ".agents", "role": "distribution-adapter", "module": "distribution-adapters", "authority": false, "evidenceStatus": "manifest", "recommendation": "recommended"},
    {"path": ".codex", "role": "public-navigation", "module": "distribution-adapters", "authority": false},
    {"path": ".codex-plugin", "role": "distribution-adapter", "module": "distribution-adapters", "authority": false, "evidenceStatus": "legacy", "recommendation": "legacy"},